{"schemaVersion":"1.0.0","id":"muxui:component:color-swatch-picker","kind":"component","name":"ColorSwatchPicker","summary":"Selects a color from a set of swatches.","lifecycle":"experimental","intent":{"useWhen":["Choosing a color from presets"],"avoidWhen":["Entering an arbitrary color"]},"anatomy":["root","swatch","selection"],"states":["idle","focused","disabled","read-only","selected"],"accessibility":{"nameRequired":true,"obligations":["Expose a named swatch collection.","Expose selected and disabled swatches."]},"bindings":{"web.react":{"schemaVersion":"2.0.0","lifecycle":"experimental","strategy":"direct","api":{"props":["aria-label","aria-labelledby","items","value","defaultValue","disabled","readOnly"],"events":["change"],"parts":["root","swatch","selection"],"defaults":{"disabled":false,"readOnly":false}},"behavior":["Controlled and uncontrolled color strings are supported.","Arrow keys move focus between swatches without selecting one.","A press on a swatch, or Space or Enter on the focused swatch, selects it.","readOnly keeps arrow-key focus movement and blocks selection: presses, Space, and Enter do not change the value.","A read-only swatch picker does not call onChange.","Does not participate in forms and admits no name; use a named ColorField to submit a color.","A null value is controlled and empty; undefined leaves the value uncontrolled.","Each item needs a distinct color, because options are keyed by color; duplicate colors throw a TypeError.","An item's label or textValue names its swatch; otherwise the swatch uses its color name.","onChange emits the selected swatch color as a CSS string in that swatch's color space.","That is rgba(r, g, b, a) for hex or RGB swatches and hsla(h, s%, l%, a) for HSL or HSB swatches."],"accessibility":["Expose a named swatch collection.","Expose selected and disabled swatches."],"tokenRecipe":{"source":"muxui:token:default-theme","requirements":[{"token":"semantic.control.radius","requirement":"required"},{"token":"semantic.focus.ring","requirement":"required"},{"token":"semantic.selection.track","requirement":"required"}]},"platformSafety":[{"profile":"web.react","requirements":[{"id":"system.forced-colors","disposition":"required"},{"id":"system.high-contrast","disposition":"required"},{"id":"native.dynamic-color","disposition":"not-applicable","reason":"Native dynamic colors do not apply to the React web binding."},{"id":"native.font-metrics","disposition":"not-applicable","reason":"Native font metrics do not apply to the React web binding."},{"id":"layout.direction","disposition":"required"},{"id":"platform.accessibility-mapping","disposition":"required"}]}],"runtimeProfiles":{}}}}
