{
  "schemaVersion": "1.0.0",
  "id": "muxui:component:drop-zone",
  "kind": "component",
  "name": "DropZone",
  "summary": "Accepts files dragged or pasted into a bounded drop target.",
  "lifecycle": "experimental",
  "intent": { "useWhen": ["Collecting files by drag and drop or paste", "An upload area that also offers a clearly named picker, with a FileTrigger inside the drop area"], "avoidWhen": ["Selecting a file from a native picker only; use FileTrigger"] },
  "anatomy": ["root", "content"],
  "states": ["idle", "drop-target", "focused", "disabled"],
  "accessibility": { "nameRequired": false, "obligations": ["Expose a keyboard- and pointer-operable drop target.", "Expose disabled state and focus indication."] },
  "bindings": {
    "web.react": {
      "schemaVersion": "2.0.0",
      "lifecycle": "experimental",
      "strategy": "direct",
      "api": {
        "props": ["children", "disabled", "onDrop", "onActivate", "className", "aria-label", "aria-labelledby"],
        "events": ["drop", "activate"],
        "parts": ["root", "content"],
        "defaults": { "disabled": false }
      },
      "behavior": [
        "Pointer, keyboard, and clipboard input all reach the same onDrop callback.",
        "onDrop receives the dropped items as a list of file, directory, and text items, not a File array.",
        "A file item reads with getFile, which resolves a File, or getText, which resolves its text.",
        "A text item reads with getText and one of the formats listed in its types.",
        "A directory item lists its contents with getEntries, an async iterator of file and directory items.",
        "Reads are asynchronous, and DropZone does not catch a failed read.",
        "DropZone does not filter items by kind or type; every dropped item arrives.",
        "onActivate runs when the drop target's own hidden button is activated.",
        "Clicks on controls inside DropZone, such as a FileTrigger, do not call onActivate.",
        "DropZone reads no browser globals during server rendering."
      ],
      "accessibility": ["Expose a keyboard drop affordance alongside pointer and clipboard input.", "Expose disabled state on the drop button and visible-focus state, and preserve the consumer-provided accessible name; a disabled root carries data-disabled for styling and aria-disabled=\"true\"."],
      "tokenRecipe": { "source": "muxui:token:default-theme", "requirements": [
        { "token": "semantic.control.radius", "requirement": "required" },
        { "token": "semantic.control.padding-inline", "requirement": "required" },
        { "token": "semantic.focus.ring", "requirement": "required" },
        { "token": "semantic.selection.track", "requirement": "required" },
        { "token": "semantic.action.selection-background", "requirement": "required" },
        { "token": "component.dropzone.drop-target-background", "requirement": "required" },
        { "token": "semantic.motion.interaction-transition", "requirement": "required" }
      ] },
      "platformSafety": [{ "profile": "web.react", "requirements": [
        { "id": "system.forced-colors", "disposition": "required" },
        { "id": "system.high-contrast", "disposition": "required" },
        { "id": "native.dynamic-color", "disposition": "not-applicable", "reason": "Native dynamic colors do not apply to the React web binding." },
        { "id": "native.font-metrics", "disposition": "not-applicable", "reason": "Native font metrics do not apply to the React web binding." },
        { "id": "layout.direction", "disposition": "required" },
        { "id": "platform.accessibility-mapping", "disposition": "required" }
      ] }],
      "runtimeProfiles": {}
    }
  }
}
