{
  "schemaVersion": "1.0.0",
  "id": "muxui:component:file-trigger",
  "kind": "component",
  "name": "FileTrigger",
  "summary": "Opens a native file picker and reports selected files.",
  "lifecycle": "experimental",
  "intent": { "useWhen": ["Selecting one or more local files"], "avoidWhen": ["Receiving files by drag and drop"] },
  "anatomy": ["root", "input"],
  "states": ["idle", "focused", "disabled"],
  "accessibility": { "nameRequired": false, "obligations": ["Expose a keyboard-operable file picker trigger.", "Keep the native input hidden from the visual layout while retaining its native picker semantics."] },
  "bindings": {
    "web.react": {
      "schemaVersion": "2.0.0",
      "lifecycle": "experimental",
      "strategy": "direct",
      "api": {
        "props": ["children", "acceptedFileTypes", "allowsMultiple", "acceptDirectory", "defaultCamera", "disabled", "onSelect", "className"],
        "events": ["select"],
        "parts": ["root", "input"],
        "defaults": { "allowsMultiple": false, "acceptDirectory": false, "disabled": false }
      },
      "behavior": [
        "onSelect receives the selected files as an array of File objects.",
        "acceptedFileTypes sets the native accept attribute, which narrows what the picker offers.",
        "allowsMultiple lets the picker select more than one file.",
        "acceptDirectory sets the native webkitdirectory attribute.",
        "defaultCamera, user or environment, sets the native capture attribute.",
        "Pressing the trigger resets the native input first, so choosing the same file again calls onSelect.",
        "FileTrigger uploads nothing, and a form does not submit the chosen files.",
        "A disabled FileTrigger disables its trigger and does not call onSelect."
      ],
      "accessibility": ["Keep activation on the consumer trigger and preserve its accessible name.", "Apply disabled behavior to the trigger while retaining the native input as a hidden implementation detail."],
      "tokenRecipe": { "source": "muxui:token:default-theme", "requirements": [
        { "token": "semantic.focus.ring", "requirement": "optional", "profiles": ["web.react"] }
      ] },
      "platformSafety": [{ "profile": "web.react", "requirements": [
        { "id": "system.forced-colors", "disposition": "required" },
        { "id": "system.high-contrast", "disposition": "required" },
        { "id": "native.dynamic-color", "disposition": "not-applicable", "reason": "Native dynamic colors do not apply to the React web binding." },
        { "id": "native.font-metrics", "disposition": "not-applicable", "reason": "Native font metrics do not apply to the React web binding." },
        { "id": "layout.direction", "disposition": "required" },
        { "id": "platform.accessibility-mapping", "disposition": "required" }
      ] }],
      "runtimeProfiles": {}
    }
  }
}
