{"schemaVersion":"1.0.0","id":"muxui:component:slider","kind":"component","name":"Slider","summary":"Adjusts a numeric value along a track.","lifecycle":"experimental","intent":{"useWhen":["Choosing an approximate value along a bounded range"],"avoidWhen":["Entering a precise value; use NumberField"]},"anatomy":["root","label","track","thumb"],"states":["idle","focused","disabled","read-only","selected"],"accessibility":{"nameRequired":true,"obligations":["Expose the slider name, range, and current value.","Expose disabled state and keyboard adjustment."]},"bindings":{"web.react":{"schemaVersion":"2.0.0","lifecycle":"experimental","strategy":"direct","behavior":["Arrow keys adjust the value by step.","Controlled and uncontrolled numeric values are supported.","Named forms submit the thumb value, and form reset restores the default value.","onChange reports the value as it changes while the thumb moves.","onChangeEnd runs when an interaction ends, such as a key press or a drag release, with the current value.","A key press at the minimum or maximum calls onChangeEnd with the same value.","Pressing and releasing the thumb without moving it calls onChangeEnd with the same value.","Cancelling a pointer drag after the thumb has moved also calls onChangeEnd.","A change to the controlled value prop calls neither callback.","A disabled or read-only Slider calls neither callback."],"accessibility":["Expose the slider name, range, and current value.","Expose disabled state and keyboard adjustment."],"tokenRecipe":{"source":"muxui:token:default-theme","requirements":[{"token":"semantic.control.radius","requirement":"required"},{"token":"semantic.control.padding-inline","requirement":"required"},{"token":"semantic.focus.ring","requirement":"required"},{"token":"semantic.selection.track","requirement":"required"}]},"platformSafety":[{"profile":"web.react","requirements":[{"id":"system.forced-colors","disposition":"required"},{"id":"system.high-contrast","disposition":"required"},{"id":"native.dynamic-color","disposition":"not-applicable","reason":"Native dynamic colors do not apply to the React web binding."},{"id":"native.font-metrics","disposition":"not-applicable","reason":"Native font metrics do not apply to the React web binding."},{"id":"layout.direction","disposition":"required"},{"id":"platform.accessibility-mapping","disposition":"required"}]}],"runtimeProfiles":{}}}}
