{"schemaVersion":"1.0.0","id":"muxui:component:text-field","kind":"component","name":"TextField","summary":"Accepts a single-line text value with validation.","lifecycle":"experimental","intent":{"useWhen":["Entering one line of text"],"avoidWhen":["Multiline text; use TextArea","Formatted content; use TextEditor","A number or a search query; use NumberField or SearchField"]},"anatomy":["root","label","input","description","error"],"states":["idle","disabled","read-only","required","invalid"],"accessibility":{"nameRequired":true,"obligations":["Expose an accessible name, description, and validation message.","Expose disabled, required, read-only, and invalid states."]},"bindings":{"web.react":{"schemaVersion":"2.0.0","lifecycle":"experimental","strategy":"direct","behavior":["Controlled and uncontrolled values are supported.","Keyboard input preserves the native accessible interaction model.","Standard native input attributes are applied to the input part.","Interactive control sizes use the shared sm, md, and lg targets; md is the default.","The forwarded ref resolves to the outer div; inputRef resolves to the native HTMLInputElement for focus and selection.","inputProps accepts native input keyboard, paste, focus, blur, selection, composition, and styling props; its className merges with the Mux input class.","Root id, value, defaultValue, onChange, name, type, accessible name, validation, disabled, readOnly, and required remain authoritative; inputProps cannot replace them. Root native input attributes take precedence when supplied.","errorMessage renders only while the field is invalid, through the invalid prop or failed native, custom, or server validation, and replaces the built-in message."],"accessibility":["Expose an accessible name, description, and validation message.","Expose disabled, required, read-only, and invalid states."],"tokenRecipe":{"source":"muxui:token:default-theme","requirements":[{"token":"semantic.field.background","requirement":"required"},{"token":"semantic.control.radius","requirement":"required"},{"token":"semantic.control.padding-inline","requirement":"required"},{"token":"semantic.focus.ring","requirement":"required"},{"token":"semantic.feedback.invalid","requirement":"required"},{"token":"semantic.control.size-sm","requirement":"required"},{"token":"semantic.control.size-md","requirement":"required"},{"token":"semantic.control.size-lg","requirement":"required"},{"token":"component.textfield.label","requirement":"required"}]},"platformSafety":[{"profile":"web.react","requirements":[{"id":"system.forced-colors","disposition":"required"},{"id":"system.high-contrast","disposition":"required"},{"id":"native.dynamic-color","disposition":"not-applicable","reason":"Native dynamic colors do not apply to the React web binding."},{"id":"native.font-metrics","disposition":"not-applicable","reason":"Native font metrics do not apply to the React web binding."},{"id":"layout.direction","disposition":"required"},{"id":"platform.accessibility-mapping","disposition":"required"}]}],"runtimeProfiles":{}}}}
