{
  "schemaVersion": "1.0.0",
  "id": "muxui:component:input",
  "kind": "component",
  "name": "Input",
  "summary": "Collect one line of text with shared label, description, and validation parts.",
  "lifecycle": "experimental",
  "intent": {
    "useWhen": [
      "Collecting a short, single-line text value."
    ],
    "avoidWhen": [
      "For multiline content, numeric ranges, or a predefined choice."
    ]
  },
  "anatomy": [
    "root",
    "input",
    "label",
    "description",
    "error"
  ],
  "states": [
    "empty",
    "filled",
    "disabled",
    "invalid",
    "focused"
  ],
  "accessibility": {
    "nameRequired": true,
    "obligations": [
      "Uses the shared Mux field vocabulary and native input serialization."
    ]
  },
  "bindings": {
    "web.react": {
      "schemaVersion": "2.0.0",
      "lifecycle": "experimental",
      "strategy": "direct",
      "api": {
        "props": [
          "value",
          "defaultValue",
          "onChange",
          "type",
          "placeholder",
          "disabled",
          "invalid",
          "required",
          "readOnly",
          "size"
        ],
        "events": [
          "change"
        ],
        "parts": [
          "root",
          "input",
          "label",
          "description",
          "error"
        ],
        "defaults": {
          "size": "md",
          "disabled": false,
          "invalid": false,
          "required": false,
          "readOnly": false
        }
      },
      "behavior": [
        "Uses the shared Mux field vocabulary and native input serialization."
      ],
      "accessibility": [
        "Uses the shared Mux field vocabulary and native input serialization."
      ],
      "tokenRecipe": {
        "source": "muxui:token:default-theme",
        "requirements": [
          {
            "token": "semantic.control.radius",
            "requirement": "required"
          },
          {
            "token": "semantic.focus.ring",
            "requirement": "required"
          },
          {
            "token": "semantic.motion.interaction-transition",
            "requirement": "required"
          },
          {
            "token": "semantic.field.placeholder",
            "requirement": "required"
          },
          { "token": "semantic.control.size-sm", "requirement": "required" },
          { "token": "semantic.control.size-md", "requirement": "required" },
          { "token": "semantic.control.size-lg", "requirement": "required" }
        ]
      },
      "platformSafety": [
        {
          "profile": "web.react",
          "requirements": [
            {
              "id": "system.forced-colors",
              "disposition": "required"
            },
            {
              "id": "system.high-contrast",
              "disposition": "required"
            },
            {
              "id": "native.dynamic-color",
              "disposition": "not-applicable",
              "reason": "Native dynamic colors do not apply to the React web binding."
            },
            {
              "id": "native.font-metrics",
              "disposition": "not-applicable",
              "reason": "Native font metrics do not apply to the React web binding."
            },
            {
              "id": "layout.direction",
              "disposition": "required"
            },
            {
              "id": "platform.accessibility-mapping",
              "disposition": "required"
            }
          ]
        }
      ],
      "runtimeProfiles": {}
    }
  }
}
