{
  "schemaVersion": "1.0.0",
  "id": "muxui:component:input-tags",
  "kind": "component",
  "name": "InputTags",
  "summary": "Enter and manage a list of free-form tags with keyboard chip navigation.",
  "lifecycle": "experimental",
  "intent": {
    "useWhen": [
      "Collecting multiple user-entered values that should remain visible as chips."
    ],
    "avoidWhen": [
      "For one scalar value or a closed set of predefined options."
    ]
  },
  "anatomy": [
    "root",
    "label",
    "group",
    "tag-wrapper",
    "tag-group",
    "tag-list",
    "tag",
    "input",
    "description",
    "error"
  ],
  "states": [
    "inline",
    "below",
    "focused",
    "disabled",
    "invalid",
    "tag-focused"
  ],
  "accessibility": {
    "nameRequired": true,
    "obligations": [
      "Enter adds a validated tag; Backspace or ArrowLeft transfers focus to the last tag.",
      "Delete removes a focused tag and restores input focus when the list empties.",
      "Stable tag IDs preserve controlled duplicate-value reconciliation."
    ]
  },
  "bindings": {
    "web.react": {
      "schemaVersion": "2.0.0",
      "lifecycle": "experimental",
      "strategy": "direct",
      "api": {
        "props": [
          "tagPlacement",
          "size",
          "placeholder",
          "value",
          "defaultValue",
          "label",
          "description",
          "errorMessage",
          "allowDuplicates",
          "maxTags",
          "validate",
          "disabled",
          "invalid",
          "required",
          "onChange",
          "onTagAdded",
          "onTagRemoved"
        ],
        "events": [
          "change",
          "tagAdded",
          "tagRemoved"
        ],
        "parts": [
          "root",
          "label",
          "group",
          "tag-wrapper",
          "tag-group",
          "tag-list",
          "tag",
          "input",
          "description",
          "error"
        ],
        "defaults": {
          "tagPlacement": "inline",
          "size": "md",
          "allowDuplicates": false,
          "disabled": false,
          "invalid": false,
          "required": false
        }
      },
      "behavior": [
        "Enter adds the trimmed draft as a tag, if it passes validation, and empties the input.",
        "Enter never submits a surrounding form.",
        "Backspace or ArrowLeft in an empty input moves focus to the last tag.",
        "A draft is rejected when it is blank, repeats an existing tag exactly, would exceed maxTags, or fails validate.",
        "The duplicate check is case-sensitive, and allowDuplicates turns it off.",
        "validate receives the trimmed draft and returns whether to accept it; it runs after the blank, duplicate, and limit checks.",
        "A rejected draft stays in the input, no callback is called, and invalid and errorMessage do not change.",
        "An added tag calls onChange with the full string array and then onTagAdded with the new tag.",
        "A removed tag calls onChange with the full string array and then onTagRemoved with the removed tag.",
        "Delete removes a focused tag and restores input focus when the list empties.",
        "Stable tag IDs preserve controlled duplicate-value reconciliation.",
        "The committed tags are the value; the text being typed is a separate draft that joins the value only when Enter adds it.",
        "The draft input has no name and the tags have no hidden inputs, so a surrounding form does not submit them.",
        "required adds an asterisk to the label and sets aria-required on the field; it does not check that the list has a tag.",
        "errorMessage is shown only while invalid is true, in place of the description."
      ],
      "accessibility": [
        "Enter adds a validated tag; Backspace or ArrowLeft transfers focus to the last tag.",
        "Delete removes a focused tag and restores input focus when the list empties.",
        "Stable tag IDs preserve controlled duplicate-value reconciliation."
      ],
      "tokenRecipe": {
        "source": "muxui:token:default-theme",
        "requirements": [
          {
            "token": "semantic.control.radius",
            "requirement": "required"
          },
          {
            "token": "semantic.focus.ring",
            "requirement": "required"
          },
          {
            "token": "semantic.motion.interaction-transition",
            "requirement": "required"
          },
          {
            "token": "semantic.motion.state-transition",
            "requirement": "required"
          },
          { "token": "semantic.control.size-sm", "requirement": "required" },
          { "token": "semantic.control.size-md", "requirement": "required" },
          { "token": "semantic.control.size-lg", "requirement": "required" }
        ]
      },
      "platformSafety": [
        {
          "profile": "web.react",
          "requirements": [
            {
              "id": "system.forced-colors",
              "disposition": "required"
            },
            {
              "id": "system.high-contrast",
              "disposition": "required"
            },
            {
              "id": "native.dynamic-color",
              "disposition": "not-applicable",
              "reason": "Native dynamic colors do not apply to the React web binding."
            },
            {
              "id": "native.font-metrics",
              "disposition": "not-applicable",
              "reason": "Native font metrics do not apply to the React web binding."
            },
            {
              "id": "layout.direction",
              "disposition": "required"
            },
            {
              "id": "platform.accessibility-mapping",
              "disposition": "required"
            }
          ]
        }
      ],
      "runtimeProfiles": {}
    }
  }
}
