{"schemaVersion":"1.0.0","id":"muxui:component:radio-group","kind":"component","name":"RadioGroup","summary":"Selects one option from a named group.","lifecycle":"experimental","intent":{"useWhen":["Choosing one option"],"avoidWhen":["Choosing multiple options"]},"anatomy":["root","label","radio"],"states":["idle","focused","disabled","read-only","invalid","selected"],"accessibility":{"nameRequired":true,"obligations":["Expose the group name and radio relationships.","Expose selected, disabled, and invalid state."]},"bindings":{"web.react":{"schemaVersion":"2.0.0","lifecycle":"experimental","strategy":"direct","api":{"props":["label","aria-label","aria-labelledby","options","children","value","defaultValue","disabled","readOnly","required","invalid","orientation","size","name"],"events":["change"],"parts":["root","label","radio"],"defaults":{"disabled":false,"readOnly":false,"required":false,"invalid":false,"orientation":"vertical","size":"md"}},"behavior":["Arrow keys move between radios.","Controlled and uncontrolled string values are supported.","Size is applied to every option target; indicators may remain visually compact.","Use options or children, not both: passing both throws a TypeError.","RadioField options go in as children and must sit inside the group.","The group supplies the selected value and size to its RadioField children.","Interactive control sizes use the shared sm, md, and lg targets; md is the default.","Named forms submit the selected option value, and form reset restores the default value."],"accessibility":["Expose the group name and radio relationships.","Expose selected, disabled, and invalid state."],"tokenRecipe":{"source":"muxui:token:default-theme","requirements":[{"token":"semantic.control.radius","requirement":"required"},{"token":"semantic.control.padding-inline","requirement":"required"},{"token":"semantic.focus.ring","requirement":"required"},{"token":"semantic.selection.track","requirement":"required"},{"token":"semantic.control.size-sm","requirement":"required"},{"token":"semantic.control.size-md","requirement":"required"},{"token":"semantic.control.size-lg","requirement":"required"}]},"platformSafety":[{"profile":"web.react","requirements":[{"id":"system.forced-colors","disposition":"required"},{"id":"system.high-contrast","disposition":"required"},{"id":"native.dynamic-color","disposition":"not-applicable","reason":"Native dynamic colors do not apply to the React web binding."},{"id":"native.font-metrics","disposition":"not-applicable","reason":"Native font metrics do not apply to the React web binding."},{"id":"layout.direction","disposition":"required"},{"id":"platform.accessibility-mapping","disposition":"required"}]}],"runtimeProfiles":{}}}}
