{"schemaVersion":"1.0.0","id":"muxui:component:preview-trigger","kind":"component","name":"PreviewTrigger","summary":"Shows delayed preview content while a trigger is hovered or focused.","lifecycle":"experimental","intent":{"useWhen":["Showing a lightweight preview before navigation","Adding detail to an item that stays usable without it"],"avoidWhen":["Content the user needs to continue; keep it in the page","Critical actions requiring confirmation; use AlertDialog","Content that opens on a press and stays open; use Popover"]},"anatomy":["trigger","root","content"],"states":["closed","opening","open","closing"],"accessibility":{"nameRequired":true,"obligations":["Open from pointer, touch long press, and keyboard focus.","Allow interactive preview content to remain reachable without trapping focus."]},"bindings":{"web.react":{"schemaVersion":"2.0.0","lifecycle":"experimental","strategy":"direct","behavior":["The preview opens after a hover delay, on touch long press, and on keyboard focus.","The pointer can move from the trigger onto the preview without closing it.","Escape closes the preview.","The preview is non-modal.","Open state is controlled with open and onOpenChange, or starts from defaultOpen when uncontrolled.","placement accepts top, bottom, start, end, top-start, top-end, bottom-start, bottom-end, start-top, start-bottom, end-top, and end-bottom.","start and end resolve through the current locale direction.","An unsupported placement, a non-finite offset or crossOffset, a non-boolean shouldFlip, or a negative or non-finite containerPadding throws a TypeError.","Keep the muxui-preview-trigger and muxui-preview-trigger__content selectors and the placement and transition state attributes for consumer styling.","With disabled set, the preview does not open, and an open one closes.","The trigger stays operable: disabled adds no aria-disabled or data-muxui-state-disabled to it."],"accessibility":["Require a focusable trigger and an accessible name for the interactive preview.","Expose dialog semantics without focus containment so the trigger and preview remain reachable.","Focus stays on the trigger when the preview opens.","Tab moves focus into the preview when the preview contains focusable content.","Escape closes the preview and returns focus to the trigger."],"tokenRecipe":{"source":"muxui:token:default-theme","requirements":[{"token":"semantic.control.radius","requirement":"required"},{"token":"semantic.control.padding-inline","requirement":"required"},{"token":"semantic.focus.ring","requirement":"required"},{"token":"semantic.overlay.background","requirement":"required"},{"token":"semantic.motion.interaction-transition","requirement":"required"}]},"platformSafety":[{"profile":"web.react","requirements":[{"id":"system.forced-colors","disposition":"required"},{"id":"system.high-contrast","disposition":"required"},{"id":"native.dynamic-color","disposition":"not-applicable","reason":"Native dynamic colors do not apply to the React web binding."},{"id":"native.font-metrics","disposition":"not-applicable","reason":"Native font metrics do not apply to the React web binding."},{"id":"layout.direction","disposition":"required"},{"id":"platform.accessibility-mapping","disposition":"required"}]}],"runtimeProfiles":{}}}}
