{
  "schemaVersion": "1.0.0",
  "id": "muxui:component:progress-bar",
  "kind": "component",
  "name": "ProgressBar",
  "summary": "Communicates task completion or indeterminate progress.",
  "lifecycle": "experimental",
  "intent": {
    "useWhen": [
      "Showing how far a task has got, or that it is waiting, such as an upload"
    ],
    "avoidWhen": [
      "Showing a static measurement; use Meter",
      "Showing progress in a compact space; use ProgressCircle"
    ]
  },
  "anatomy": [
    "root",
    "label",
    "track",
    "fill"
  ],
  "states": [
    "idle",
    "progress",
    "indeterminate",
    "complete"
  ],
  "accessibility": {
    "nameRequired": true,
    "obligations": [
      "Expose determinate or indeterminate progress",
      "Expose value and label when determinate"
    ]
  },
  "bindings": {
    "web.html": {
      "schemaVersion": "2.0.0",
      "strategy": "unsupported",
      "reason": "Parked by Decision 0031: no responsible implementation until W1.0 restores @muxui/web.",
      "platformSafety": [
        {
          "profile": "web.html",
          "requirements": [
            {
              "id": "system.forced-colors",
              "disposition": "not-applicable",
              "reason": "web.html is unsupported, so no platform-safety requirement applies."
            },
            {
              "id": "system.high-contrast",
              "disposition": "not-applicable",
              "reason": "web.html is unsupported, so no platform-safety requirement applies."
            },
            {
              "id": "native.dynamic-color",
              "disposition": "not-applicable",
              "reason": "web.html is unsupported, so no platform-safety requirement applies."
            },
            {
              "id": "native.font-metrics",
              "disposition": "not-applicable",
              "reason": "web.html is unsupported, so no platform-safety requirement applies."
            },
            {
              "id": "layout.direction",
              "disposition": "not-applicable",
              "reason": "web.html is unsupported, so no platform-safety requirement applies."
            },
            {
              "id": "platform.accessibility-mapping",
              "disposition": "not-applicable",
              "reason": "web.html is unsupported, so no platform-safety requirement applies."
            }
          ]
        }
      ]
    },
    "web.react": {
      "schemaVersion": "2.0.0",
      "lifecycle": "experimental",
      "strategy": "direct",
      "api": {
        "props": [
          "value",
          "minValue",
          "maxValue",
          "label"
        ],
        "events": [],
        "parts": [
          "root",
          "label",
          "track",
          "fill"
        ],
        "defaults": {
          "minValue": 0,
          "maxValue": 100
        }
      },
      "behavior": [
        "Determinate values are clamped to the range",
        "Omitted value produces an indeterminate progressbar",
        "Determinate completion is exposed when value reaches or exceeds maxValue",
        "A value of 0 is determinate: it shows 0% and an empty fill.",
        "The visible value text is Loading while indeterminate, and the percent of the range with a % sign otherwise.",
        "The percent is not rounded: a value of 33.3333 shows 33.3333%.",
        "The text Loading is built in and is not localized.",
        "ProgressBar holds no task or result state: it renders the value it is given."
      ],
      "accessibility": [
        "Expose progressbar role and value semantics without continuous motion"
      ],
      "tokenRecipe": {
        "source": "muxui:token:default-theme",
        "requirements": [
          {
            "token": "semantic.control.radius",
            "requirement": "required"
          },
          {
            "token": "semantic.selection.track",
            "requirement": "required"
          },
          {
            "token": "semantic.motion.progress-update-duration",
            "requirement": "required"
          },
          {
            "token": "semantic.motion.interaction-easing",
            "requirement": "required"
          },
          {
            "token": "semantic.motion.progress-travel-duration",
            "requirement": "required"
          },
          {
            "token": "semantic.motion.progress-easing",
            "requirement": "required"
          }
        ]
      },
      "platformSafety": [
        {
          "profile": "web.react",
          "requirements": [
            {
              "id": "system.forced-colors",
              "disposition": "required"
            },
            {
              "id": "system.high-contrast",
              "disposition": "required"
            },
            {
              "id": "native.dynamic-color",
              "disposition": "not-applicable",
              "reason": "Native dynamic colors do not apply to web.react."
            },
            {
              "id": "native.font-metrics",
              "disposition": "not-applicable",
              "reason": "Native font metrics do not apply to web.react."
            },
            {
              "id": "layout.direction",
              "disposition": "required"
            },
            {
              "id": "platform.accessibility-mapping",
              "disposition": "required"
            }
          ]
        }
      ],
      "runtimeProfiles": {}
    }
  }
}
