{"schemaVersion":"1.0.0","id":"muxui:component:token-field","kind":"component","name":"TokenField","summary":"Edits a list of inline tokens; Enter turns typed text into a token.","lifecycle":"experimental","intent":{"useWhen":["Entering tags, mentions, or structured tokens"],"avoidWhen":["Entering a single scalar value"]},"anatomy":["root","label","input","token"],"states":["idle","focused","disabled","read-only"],"accessibility":{"nameRequired":true,"obligations":["Relate the label and input to inline tokens.","Expose disabled and read-only state and normalized values."]},"bindings":{"web.react":{"schemaVersion":"2.0.0","lifecycle":"experimental","strategy":"direct","api":{"props":["label","aria-label","aria-labelledby","value","defaultValue","disabled","readOnly","name","placeholder"],"events":["change"],"parts":["root","label","input","token"],"defaults":{"disabled":false,"readOnly":false}},"behavior":["Controlled and uncontrolled string token arrays are supported.","Backspace removes the adjacent token when focused.","Typed text stays a draft until Enter turns it into a token in place.","Enter trims each typed text run, and blank drafts are ignored.","Comma has no special meaning, and duplicate tokens are kept.","onChange reports only the token array, and fires only when the tokens change.","A named TokenField submits one form entry per token under its name; read them with FormData.getAll.","An empty token array submits no entry, a disabled field submits no tokens, and a read-only field still submits its tokens.","Text that has not been turned into a token is not submitted.","Resetting the form restores an uncontrolled field to the tokens it had when it mounted and clears the draft text.","A later change to defaultValue does not replace the tokens a reset restores.","A controlled field is not changed by a reset, so the application restores it."],"accessibility":["Relate the label and input to inline tokens.","Expose disabled and read-only state and normalized values."],"tokenRecipe":{"source":"muxui:token:default-theme","requirements":[{"token":"semantic.control.radius","requirement":"required"},{"token":"semantic.control.padding-inline","requirement":"required"},{"token":"semantic.focus.ring","requirement":"required"},{"token":"semantic.feedback.invalid","requirement":"required"}]},"platformSafety":[{"profile":"web.react","requirements":[{"id":"system.forced-colors","disposition":"required"},{"id":"system.high-contrast","disposition":"required"},{"id":"native.dynamic-color","disposition":"not-applicable","reason":"Native dynamic colors do not apply to the React web binding."},{"id":"native.font-metrics","disposition":"not-applicable","reason":"Native font metrics do not apply to the React web binding."},{"id":"layout.direction","disposition":"required"},{"id":"platform.accessibility-mapping","disposition":"required"}]}],"runtimeProfiles":{}}}}
