{
  "schemaVersion": "1.0.0",
  "id": "muxui:component:image",
  "kind": "component",
  "name": "Image",
  "summary": "Present a native image with Mux styling and bounded source recovery.",
  "lifecycle": "experimental",
  "intent": {
    "useWhen": [
      "Presenting an image while preserving native image dimensions, loading, and events.",
      "Showing a photo, screenshot, diagram, or illustration in a box with a declared width and height."
    ],
    "avoidWhen": [
      "Cropping, editing, or processing image content.",
      "Showing a compact picture of a person or workspace; use Avatar.",
      "Opening a larger view of a picture; use Lightbox."
    ]
  },
  "anatomy": [
    "root"
  ],
  "states": [
    "default",
    "fallback",
    "error",
    "radius-sm",
    "radius-md",
    "radius-lg",
    "radius-full"
  ],
  "accessibility": {
    "nameRequired": true,
    "obligations": [
      "Supply a meaningful alt string for informative images; use alt=\"\" for decorative images.",
      "Preserve native image dimensions, source-set selection, refs, and load/error events.",
      "When a fallback source is supplied, retry it once after the primary source fails and reset recovery when src or srcSet changes."
    ]
  },
  "bindings": {
    "web.react": {
      "schemaVersion": "2.0.0",
      "lifecycle": "experimental",
      "strategy": "direct",
      "api": {
        "props": [
          "src",
          "srcSet",
          "sizes",
          "alt",
          "width",
          "height",
          "loading",
          "decoding",
          "fallbackSrc",
          "fallbackSrcSet",
          "radius",
          "fit"
        ],
        "events": [
          "load",
          "error"
        ],
        "parts": [
          "root"
        ],
        "defaults": {
          "radius": "none",
          "fit": "cover"
        }
      },
      "behavior": [
        "Renders a native HTMLImageElement and forwards native attributes, dimensions, refs, and callbacks.",
        "When the primary source fails to load and fallbackSrc or fallbackSrcSet is supplied, the image switches to the fallback once and sets data-fallback.",
        "If the fallback also fails, or none is supplied, the image sets data-error, keeps the failed source, and tries nothing further.",
        "Changing src, srcSet, fallbackSrc, or fallbackSrcSet starts recovery over, so the new primary source is tried first.",
        "onError runs for every load error, including the failure of the fallback.",
        "radius and fit select the muxui-image--radius-* and muxui-image--fit-* modifier classes without changing intrinsic image dimensions.",
        "When width and height are both set, the declared box keeps its ratio through the --muxui-image-ratio custom property, so fit applies and loading does not shift layout.",
        "Consumer classes and styles can override --muxui-image-ratio."
      ],
      "accessibility": [
        "alt is required by the public type and runtime contract; an empty alt keeps decorative images out of the accessibility tree.",
        "The native image remains the accessible host and no loading animation is introduced."
      ],
      "tokenRecipe": {
        "source": "muxui:token:default-theme",
        "requirements": [
          { "token": "semantic.shape.radius-s", "requirement": "required" },
          { "token": "semantic.shape.option-radius", "requirement": "required" },
          { "token": "semantic.shape.container-radius", "requirement": "required" },
          { "token": "semantic.shape.pill-radius", "requirement": "required" }
        ]
      },
      "platformSafety": [
        {
          "profile": "web.react",
          "requirements": [
            { "id": "system.forced-colors", "disposition": "required" },
            { "id": "system.high-contrast", "disposition": "required" },
            { "id": "native.dynamic-color", "disposition": "not-applicable", "reason": "Native dynamic colors do not apply to the React web binding." },
            { "id": "native.font-metrics", "disposition": "not-applicable", "reason": "Native font metrics do not apply to the React web binding." },
            { "id": "layout.direction", "disposition": "required" },
            { "id": "platform.accessibility-mapping", "disposition": "required" }
          ]
        }
      ],
      "runtimeProfiles": {}
    }
  }
}
