{"schemaVersion":"1.0.0","id":"muxui:component:table","kind":"component","name":"Table","summary":"Displays structured data with selectable rows and columns.","lifecycle":"experimental","intent":{"useWhen":["Displaying tabular data","Comparing rows across columns"],"avoidWhen":["Presenting a short action list; use Menu","Showing items that are not compared across columns; use GridList"]},"anatomy":["root","header","column","body","row","cell"],"states":["idle","focused","disabled","selected","empty"],"accessibility":{"nameRequired":true,"obligations":["Expose table, header, row, column, and cell semantics.","Expose row selection and keyboard focus.","Expose sort state on sortable column headers."]},"bindings":{"web.react":{"schemaVersion":"2.0.0","lifecycle":"experimental","strategy":"direct","api":{"props":["aria-label","columns","rows","selectedIds","defaultSelectedIds","sortDescriptor","disabled","selectionMode"],"events":["selectionChange","rowAction","sortChange"],"parts":["root","header","column","body","row","cell"],"defaults":{"disabled":false,"selectionMode":"none"}},"behavior":["Keyboard navigation moves through rows and cells.","Selection is either controlled by the application or managed by the component.","With onRowAction set and selectionMode multiple, a click or Enter on a row runs the action while nothing is selected, so pointer users start a selection with Space or a selection affordance in the row content.","A column with sortable: true has a sortable header. Activating it by click, Enter, or Space reports sortChange with the column and direction, toggling between ascending and descending; sortDescriptor sets the sorted column.","Table never sorts rows: it renders them in the order supplied, so the application sorts its rows when sortChange reports a new sort.","A sort shows only when the application passes it back as sortDescriptor.","sortDescriptor is an object with column and direction, which is ascending or descending. column must be the id of a column with sortable: true, or Table throws a TypeError.","Selection follows each row's id when the rows reorder, so give every row an id that stays with its data.","A row without an id takes its key, value, or position as its id, so after a reorder its selection can sit on a different row.","A sorted column shows a chevron after its label, up for ascending and down for descending. An unsorted sortable header shows an upward chevron only on pointer hover or keyboard focus. Every sortable header reserves the chevron slot, so labels never shift, and non-sortable headers show no chevron.","A disabled Table sets data-disabled on its root, ignores sort changes, and shows no hover or focus sort hint."],"accessibility":["Expose table, header, row, column, and cell semantics.","Expose row selection and keyboard focus.","Expose aria-sort on sortable column headers; the sort chevron is decorative and hidden from assistive technology."],"tokenRecipe":{"source":"muxui:token:default-theme","requirements":[{"token":"semantic.control.radius","requirement":"required"},{"token":"semantic.control.padding-inline","requirement":"required"},{"token":"semantic.focus.ring","requirement":"required"},{"token":"semantic.selection.background","requirement":"required"}]},"platformSafety":[{"profile":"web.react","requirements":[{"id":"system.forced-colors","disposition":"required"},{"id":"system.high-contrast","disposition":"required"},{"id":"native.dynamic-color","disposition":"not-applicable","reason":"Native dynamic colors do not apply to the React web binding."},{"id":"native.font-metrics","disposition":"not-applicable","reason":"Native font metrics do not apply to the React web binding."},{"id":"layout.direction","disposition":"required"},{"id":"platform.accessibility-mapping","disposition":"required"}]}],"runtimeProfiles":{}}}}
